{
  "node": "what-are-containers",
  "lesson": "le-probleme-a-resoudre",
  "title": "Expliquer « ça marche sur ma machine »",
  "statement": "Un développeur te dit : « Mon application tourne parfaitement sur mon poste, mais elle plante en production avec une erreur de bibliothèque manquante. Je ne comprends pas, c'est le même code ! » En quelques phrases : (1) nomme la cause profonde, (2) explique pourquoi le code identique ne suffit pas, (3) dis en quoi un conteneur règle le problème.",
  "skeleton": "Cause profonde :\n\nPourquoi le même code ne suffit pas :\n\nCe qu'apporte un conteneur :\n",
  "solution": "Cause profonde : la dérive d'environnement. L'application ne suffit pas à elle seule, elle a besoin d'un environnement autour d'elle (version du langage, bibliothèques, variables système, outils). Le code est identique, mais l'environnement de production diffère de celui du poste : il manque la bibliothèque attendue. L'application comptait sur ce qui était installé sur la machine du développeur, pas embarqué avec elle. Ce qu'apporte un conteneur : il empaquète l'application ET toutes ses dépendances dans une unité isolée et portable qui tourne à l'identique partout. L'application n'a plus besoin de ce qui est installé sur l'hôte, donc ce qui tourne dans le conteneur sur le poste est exactement ce qui tourne en production. Le « ça marche chez moi » disparaît.",
  "keyPoints": ["environnement", "dépendances", "identique", "conteneur", "portable"],
  "language": "text"
}
