{
  "node": "patterns-principles",
  "lesson": "la-boite-a-outils-de-decision",
  "title": "Où placer le curseur ACID vs cohérence à terme ?",
  "statement": "Tu conçois une boutique en ligne. Un développeur veut mettre TOUTES les données dans une seule base, avec le même niveau de garantie partout. Prends deux fonctions opposées : (a) le paiement d'une commande (débiter la carte et décrémenter le stock), (b) le compteur « X personnes regardent ce produit » affiché sur la fiche. Pour chacune, dis si tu privilégies la COHÉRENCE FORTE (ACID) ou la COHÉRENCE À TERME, et JUSTIFIE avec le vocabulaire CAP (cohérence, disponibilité). Conclus par la règle générale que tu appliques. Réponds en 6 à 10 phrases.",
  "skeleton": "# (a) Paiement d'une commande\n- Ce qui prime :\n- Choix (ACID ou cohérence a terme) :\n- Pourquoi :\n\n# (b) Compteur de spectateurs du produit\n- Ce qui prime :\n- Choix :\n- Pourquoi :\n\n# Regle generale que j'applique\n- \n",
  "solution": "L'idée centrale est de ne PAS imposer une seule garantie partout, mais de placer le curseur PAR CAS D'USAGE. (a) Paiement d'une commande : ce qui prime est l'exactitude immédiate : on ne peut tolérer ni double débit, ni stock vendu deux fois, ni état à moitié appliqué. Je choisis donc la COHÉRENCE FORTE (ACID) : une transaction atomique (débit + décrément du stock réussissent ensemble ou pas du tout), isolée et durable, dans une base transactionnelle. En termes CAP, ce cas privilégie la Cohérence quitte à sacrifier un peu de disponibilité : mieux vaut refuser temporairement le paiement que corrompre un solde ou survendre. (b) Compteur « X personnes regardent ce produit » : ce qui prime est la disponibilité et la vitesse d'affichage, tandis qu'une valeur légèrement périmée est sans conséquence (afficher 11 au lieu de 12 spectateurs n'a aucune importance). Je choisis donc la COHÉRENCE À TERME : le compteur peut être servi depuis une réplique, mis à jour avec un léger retard, et rester disponible même sous forte charge. En CAP, ce cas privilégie la disponibilité (AP). Règle générale : je classe chaque fonction par son attribut de qualité prioritaire, cohérence forte (ACID) là où l'exactitude est vitale (l'argent, le stock au paiement), cohérence à terme là où la disponibilité et la latence priment et où une obsolescence temporaire est tolérable (compteurs, fils, statistiques d'affichage). Le système final est donc HYBRIDE, ce qui est la norme : un cœur ACID pour ce qui doit être juste, des vues à cohérence à terme pour ce qui doit être rapide et disponible. Imposer une seule garantie partout serait une erreur : la cohérence forte partout coûte cher en disponibilité pour un compteur qui n'en a pas besoin, et la cohérence à terme partout serait catastrophique pour un paiement.",
  "keyPoints": ["cohérence forte", "ACID", "atomique", "cohérence à terme", "disponibilité", "cas d'usage", "hybride"],
  "language": "text"
}
