{
  "node": "decision-making",
  "lesson": "arbitrer-et-simplifier",
  "title": "Résister à l'architecture impressionnante",
  "statement": "Pour un petit outil interne utilisé par une trentaine de personnes, un architecte junior propose une architecture en microservices avec Kafka et event sourcing, « parce que c'est de l'ingénierie sérieuse ». L'équipe est composée de trois développeurs. En 6 à 9 phrases, analyse la proposition : distingue la complexité essentielle de la complexité accidentelle et dis laquelle est ajoutée ici, applique la question « au détriment de quoi ? » aux bénéfices annoncés, nomme au moins deux biais à l'œuvre, cite les deux garde-fous à opposer et propose une architecture de départ plus simple.",
  "skeleton": "# Complexité\n- Essentielle vs accidentelle : laquelle est ajoutée ici ?\n\n# Au détriment de quoi ?\n- Bénéfices annoncés → prix payé :\n\n# Biais repérés\n- \n\n# Garde-fous\n- \n\n# Architecture de départ proposée\n- \n",
  "solution": "La complexité essentielle est celle du problème métier (gérer un petit outil interne), et elle est ici très faible ; la proposition ajoute au contraire une énorme complexité accidentelle (celle qu'on crée par nos choix) que rien dans le besoin ne réclame : microservices, Kafka et event sourcing apportent du réseau, des pannes partielles, du versionnement d'événements et une infrastructure critique à exploiter. Appliquons « au détriment de quoi ? » : les bénéfices annoncés (scalabilité, découplage, auditabilité) ne sont pas nécessaires pour trente utilisateurs, alors que le prix est immédiat (vélocité effondrée, trois développeurs qui passent leur temps en plomberie au lieu de livrer de la valeur, exploitation coûteuse). Les biais à l'œuvre sont le biais de nouveauté (« ingénierie sérieuse », adopter les technos à la mode), le marteau doré (plaquer une pile impressionnante quel que soit le problème) et la sur-ingénierie par anticipation (bâtir pour une échelle hypothétique qu'on n'aura pas). Les deux garde-fous à opposer sont YAGNI (tu n'en auras pas besoin : ne construis pas ce dont le besoin réel n'existe pas) et KISS (fais simple : la solution la plus simple qui marche). Architecture de départ proposée : un monolithe modulaire avec des frontières nettes, une base SQL classique, et de la messagerie ou des services séparés seulement si un besoin réel apparaît plus tard (on peut extraire un module via Strangler Fig le moment venu). On documente ce choix et ses raisons dans un ADR, et on diffère la complexité jusqu'au dernier moment responsable, quand le contexte la justifiera vraiment.",
  "keyPoints": ["complexité essentielle", "complexité accidentelle", "au détriment de quoi", "biais de nouveauté", "marteau doré", "sur-ingénierie", "YAGNI", "KISS", "monolithe"],
  "language": "text"
}
