{
  "node": "jshell-outils",
  "lesson": "demarrer-jshell",
  "title": "Teste une expression dans JShell",
  "statement": "Écris la ligne de code à taper à l'invite jshell> pour obtenir la version en majuscules du mot \"devroad\". Tu dois utiliser la méthode toUpperCase() sur la chaine. Écris seulement l'expression Java, sans point-virgule.",
  "skeleton": "// À l'invite jshell>, tape une expression qui met \"devroad\" en majuscules\n",
  "solution": "\"devroad\".toUpperCase()",
  "keyPoints": ["\"devroad\"", "toUpperCase()", "expression sans point-virgule"],
  "language": "java"
}
