{
  "node": "build-dependances",
  "lesson": "ajouter-une-dependance",
  "title": "Ajoute la dépendance Gson au pom.xml",
  "statement": "Complète le bloc <dependencies> pour ajouter la bibliothèque Gson, coordonnées groupId com.google.code.gson, artifactId gson, version 2.11.0. Écris un seul bloc <dependency> avec les trois coordonnées.",
  "skeleton": "<dependencies>\n    <!-- Ajoute ici le bloc <dependency> pour Gson 2.11.0 -->\n\n</dependencies>",
  "solution": "<dependencies>\n    <dependency>\n        <groupId>com.google.code.gson</groupId>\n        <artifactId>gson</artifactId>\n        <version>2.11.0</version>\n    </dependency>\n</dependencies>",
  "keyPoints": ["dependency", "com.google.code.gson", "gson", "2.11.0"],
  "language": "xml"
}
