{
  "node": "java-language",
  "lesson": "pattern-matching-switch",
  "title": "Calculer une aire par pattern matching",
  "statement": "On dispose d'une interface `sealed interface Shape permits Circle, Rectangle {}` avec `record Circle(double radius)` et `record Rectangle(double width, double height)`. Écrivez une méthode `double area(Shape s)` utilisant un `switch` avec **record patterns** (sans `default`, en s'appuyant sur l'exhaustivité).",
  "skeleton": "double area(Shape s) {\n    return switch (s) {\n        // complétez les cas Circle et Rectangle\n    };\n}",
  "solution": "double area(Shape s) {\n    return switch (s) {\n        case Circle(double r) -> Math.PI * r * r;\n        case Rectangle(double w, double h) -> w * h;\n    };\n}",
  "keyPoints": ["switch (s)", "case Circle(double r)", "case Rectangle(double w, double h)", "Math.PI"],
  "language": "java"
}
