{
  "node": "security",
  "lesson": "secrets-et-scan",
  "title": "Sortir un mot de passe du code",
  "statement": "Ce code met un secret EN DUR, ce qui l'expose à jamais dans Git : `resource \"aws_db_instance\" \"db\" { password = \"S3cr3t!\" }`. Corrige-le pour que le secret vienne de l'extérieur du code. (1) Déclare une variable `db_password` de type `string`, SANS valeur par défaut, et marquée `sensitive = true` (pour ne pas l'afficher à l'écran). (2) Dans la ressource, référence cette variable au lieu de la valeur en dur. Le mot de passe sera fourni au lancement via la variable d'environnement `TF_VAR_db_password`, donc jamais écrit dans un fichier.",
  "skeleton": "variable \"db_password\" {\n  # a completer : type et sensible\n}\n\nresource \"aws_db_instance\" \"db\" {\n  # reference la variable au lieu de la valeur en dur\n}\n",
  "solution": "variable \"db_password\" {\n  type      = string\n  sensitive = true\n}\n\nresource \"aws_db_instance\" \"db\" {\n  password = var.db_password\n}",
  "keyPoints": ["variable \"db_password\"", "type", "string", "sensitive = true", "var.db_password"],
  "language": "hcl"
}
