{
  "node": "core-workflow",
  "lesson": "drift-target-exit-codes",
  "title": "Détecter la dérive dans un job nocturne",
  "statement": "Un job nocturne doit DÉTECTER une dérive (une ressource modifiée à la main, hors Terraform) SANS rien appliquer, et renvoyer un code de sortie exploitable par le pipeline (0 = rien, 2 = dérive détectée, 1 = erreur). Écris la commande unique `terraform` qui fait cela.",
  "skeleton": "# une seule commande : détecter la dérive + code de sortie détaillé\n",
  "solution": "terraform plan -refresh-only -detailed-exitcode",
  "keyPoints": ["terraform plan", "-refresh-only", "-detailed-exitcode"],
  "language": "bash"
}
