{
  "node": "clean-code-practices",
  "lesson": "pratiques-au-quotidien",
  "title": "Aplatir avec des early returns",
  "statement": "Cette fonction range un âge dans une catégorie, mais avec des `if` imbriqués qui gonflent la complexité. Réécris-la avec des **early returns** (des gardes en tête de fonction) pour la rendre plate, sans changer son comportement : elle lève une `IllegalArgumentException` si l'âge est négatif ou supérieur à 150, renvoie `\"mineur\"` en dessous de 18 ans, et `\"majeur\"` sinon.",
  "skeleton": "String categorie(int age) {\n    // réécris ce corps avec des gardes en early return\n}",
  "solution": "String categorie(int age) {\n    if (age < 0 || age > 150) throw new IllegalArgumentException();\n    if (age < 18) return \"mineur\";\n    return \"majeur\";\n}",
  "keyPoints": ["if (age < 0 || age > 150)", "throw new IllegalArgumentException", "return \"mineur\"", "return \"majeur\""],
  "language": "java"
}
