{
  "node": "state-operations",
  "lesson": "replace-provider-et-force-unlock",
  "title": "Migrer la source du provider vers OpenTofu",
  "statement": "Tu migres un projet de Terraform vers OpenTofu. Dans l'état, la source du provider AWS est encore `registry.terraform.io/hashicorp/aws` ; elle doit devenir `registry.opentofu.org/hashicorp/aws`, SANS recréer les ressources. Écris la commande `terraform state replace-provider` qui met à jour cette référence (ancienne source en premier, nouvelle source en second).",
  "skeleton": "# Mets à jour la référence de provider dans l'état, sans rien recréer\n# terraform state replace-provider <ancienne_source> <nouvelle_source>\n",
  "solution": "terraform state replace-provider registry.terraform.io/hashicorp/aws registry.opentofu.org/hashicorp/aws",
  "keyPoints": ["terraform state replace-provider", "registry.terraform.io/hashicorp/aws", "registry.opentofu.org/hashicorp/aws"],
  "language": "bash"
}
