{
  "node": "enterprise-software",
  "lesson": "build-vs-buy",
  "title": "Distiller le domaine : que construit-on, qu'achète-t-on ?",
  "statement": "Une startup de streaming musical se distingue par son moteur de recommandation (les playlists personnalisées qui font revenir les abonnés). Pour aller vite, la cheffe de produit propose deux choses : (a) développer en interne un système maison de facturation, de gestion de la paie et des congés des salariés ; (b) acheter un moteur de recommandation du marché en SaaS et le customiser lourdement pour l'adapter à leur catalogue. Écris une réponse courte qui : (1) classe chaque besoin en cœur de métier ou générique, (2) dit ce qu'il faut construire et ce qu'il faut acheter, (3) explique pourquoi les deux propositions sont à l'envers, (4) cite au moins deux risques concrets de la sur-personnalisation du SaaS et la parade (couche anti-corruption, vendor lock-in, TCO).",
  "skeleton": "Rappel de la règle : acheter le générique, construire le différenciant.\n\nCoeur de metier (differenciant) : ...\nSous-domaines generiques : ...\nCe qu'on construit : ...\nCe qu'on achete : ...\nPourquoi les deux propositions sont a l'envers : ...\nRisques de la sur-personnalisation du SaaS + parade : ...",
  "solution": "Classement. Le coeur de metier (differenciant) est le moteur de recommandation : c'est ce qui fait revenir les abonnes, la valeur unique de l'entreprise, la raison pour laquelle un client la choisit plutot qu'un concurrent. Les besoins generiques sont la facturation, la paie et la gestion des conges : des sous-domaines banals, communs a toutes les entreprises, non differenciants, complexes et tres reglementes (fiscalite, droit du travail), deja resolus par des editeurs matures.\n\nCe qu'on construit / ce qu'on achete. On CONSTRUIT le moteur de recommandation soi-meme, avec le maximum de soin (les meilleurs developpeurs), car aucun produit du marche ne connait cette differenciation. On ACHETE ou on integre le generique : un progiciel de paie et un logiciel de facturation standard, en adaptant autant que possible ses processus au standard plutot que l'inverse.\n\nPourquoi les deux propositions sont a l'envers. Elles inversent exactement la logique build vs buy : elles construisent le generique et forcent le differenciant dans du standard. (a) Developper une paie/facturation maison, c'est du build sur du generique : un gaspillage d'effort massif sur ce qui ne cree aucun avantage, avec en prime la charge permanente de suivre les evolutions reglementaires, un fardeau que les editeurs absorbent pour tous leurs clients. (b) Acheter un moteur de recommandation SaaS et le customiser lourdement, c'est forcer le core dans un produit generique : on confie a un tiers ce qui devrait etre l'avantage concurrentiel, et aucun produit standard ne portera cette differenciation. On perd la maitrise de la valeur de l'entreprise.\n\nRisques de la sur-personnalisation du SaaS + parade. Plus on customise un progiciel, plus on s'enferme : (1) les mises a jour de l'editeur deviennent douloureuses (les personnalisations risquent de casser a chaque version) ; (2) on tombe dans le vendor lock-in (couplage au fournisseur) : dependance forte a l'editeur, impossible d'en changer sans tout casser ; (3) le cout total de possession (TCO) explose (licences + customisations fragiles + exploitation + montees de version), bien au-dela du prix d'achat affiche ; (4) le modele du progiciel et ses bizarreries risquent de contaminer le reste du SI. Parade : eviter la sur-personnalisation (viser un coeur propre, personnaliser par extensions plutot qu'en modifiant le produit) et, quel que soit le progiciel achete, l'isoler derriere une couche anti-corruption pour que son modele ne contamine pas les autres systemes. En resume : construire le moteur de recommandation (differenciant), acheter la paie et la facturation (generique), l'inverse exact des deux propositions.",
  "keyPoints": ["coeur de metier", "generique", "moteur de recommandation", "paie", "construire", "acheter", "sur-personnalisation", "couche anti-corruption", "vendor lock-in", "TCO"],
  "language": "text"
}
