{
  "node": "architectural-styles",
  "lesson": "choisir-un-style",
  "title": "Monolithe modulaire ou microservices d'emblée ?",
  "statement": "Une jeune entreprise de 8 développeurs lance un tout nouveau produit dont le domaine (les règles métier) est encore mal connu. Le directeur technique veut « partir directement en microservices, pour être scalable dès le début ». En t'appuyant sur les attributs de qualité et le contexte, écris une réponse courte qui : (1) recommande un style, (2) donne au moins DEUX raisons concrètes contre les microservices ICI, (3) explique le risque du « monolithe distribué », et (4) montre comment ton choix garde la porte ouverte à une distribution future si un vrai besoin apparaît.",
  "skeleton": "Rappel : la modularité (bien ranger le code) prime sur la distribution (éclater sur le réseau).\n\nStyle recommandé : ...\nRaison 1 contre les microservices ici : ...\nRaison 2 contre les microservices ici : ...\nRisque du monolithe distribué : ...\nComment on garde la porte ouverte plus tard : ...",
  "solution": "Style recommandé : un monolithe modulaire, c'est-à-dire un seul déployable mais découpé en modules à frontières nettes (contextes bornés), chacun propriétaire de ses données et communiquant par des interfaces claires.\n\nRaison 1 contre les microservices ici : ils résolvent d'abord un problème d'échelle organisationnelle (plusieurs équipes qui déploient chacune de leur côté sans se gêner) et de scalabilité ciblée (ne renforcer que la partie qui sature). Une équipe de 8 personnes n'a aucun de ces deux problèmes. « Être scalable dès le début » n'est pas un besoin mesuré, c'est un biais de nouveauté.\n\nRaison 2 contre les microservices ici : le coût est immédiat et se paie en opérationnel. Distribuer déplace la complexité du code vers l'exploitation : appels réseau qui peuvent échouer, service discovery, API gateway, tracing distribué, orchestration, sécurité de service à service, et surtout la perte de la transaction ACID globale (il faut gérer la cohérence des données réparties avec des Sagas). Une petite équipe passerait son temps en plomberie au lieu de livrer de la valeur, sans avoir la maturité opérationnelle pour exploiter N services. De plus, comme le domaine est mal connu, découper en services fige de mauvaises frontières au pire moment, et corriger un découpage de services coûte bien plus cher que réorganiser des modules internes.\n\nRisque du monolithe distribué : sans expérience, on obtient souvent des services fortement couplés (base partagée, appels synchrones en chaîne) qu'on est obligé de déployer ensemble. On paie alors le prix du réseau sans gagner l'autonomie : tous les inconvénients, aucun avantage.\n\nComment on garde la porte ouverte plus tard : les frontières de modules bien tenues d'un monolithe modulaire deviennent les coutures d'extraction du futur. Le jour où un vrai besoin apparaît (un module doit scaler seul, ou l'entreprise grandit en plusieurs équipes), on extrait ce module en service en coupant le long de ces murs déjà en place, progressivement, avec la technique du Strangler Fig, sans tout réécrire. On documente la décision et ses conséquences en ADR, avec les indicateurs qui déclencheraient une extraction. La règle directrice reste : la modularité prime sur la distribution, on ne distribue que lorsqu'un problème réel (échelle, autonomie d'équipe) l'exige.",
  "keyPoints": ["monolithe modulaire", "microservices", "échelle organisationnelle", "scalabilité ciblée", "opérationnel", "monolithe distribué", "couplés", "Strangler Fig", "contexte", "modularité"],
  "language": "text"
}
